paper_index,authors,title7F6BCAE6,dejan kostic + adolfo rodriguez + amin vahdat,Scalability in adaptive multi-metric overlays5C9EC7A8,herve menager + zoe lacroix,SemanticBio: Building Conceptual Scientific Workflows over Web Services7F868359,anne marita honkaranta + tommi karkkainen + miika nurminen,ExtMiner: combining multiple ranking and clustering algorithms for structured document retrievalNE36644,weblink,"sivashanmugam. k, verma, k, mulye, r, zhong, z, and sheth a"7DA99BEA,jayant madhavan + philip a bernstein + anhai doan + alon halevy,Corpus-based schema matchingNE30583,mary f. fernandez,declarative specification of web sites with strudel6E5116A3,hasan jamil + zhijie guan,Streamlining biological data analysis using BioFlow0A381A4F,humberto cervantes + richard s hall,Automating Service Dependency Management in a Service-Oriented Component Model7C87AB40,sudipto guha + boulos harb,Approximation Algorithms for Wavelet Transform Coding of Data Streams808F1082,renee j miller + laura m haas + mauricio hernandez,Clio: a semi-automatic tool for schema mapping5C1BD683,keishi tajima + yoshiki fukui,Answering xpath queries over networks by sending minimal views58778738,jeremy a hylton,Identifying and Merging Related Bibliographic Records025D573E,andy seaborne,RDQL-A Query Language for RDF5B1181F4,leonard kleinrock,queueing systems: volume ii772DF95C,walter a burkhard,Hashing and trie algorithms for partial match retrieval7655A4BA,eric n hanson + linda g shapiro + timos sellis + rm kung + michael stonebraker + yannis ioannidis,Heuristic search in database systems7A120658,stanley m selkow,The tree-to-tree editing problem76353109,wenlian hsu + george l nemhauser,Easy and hard bottleneck location problems5E152636,louiqa raschid + mariaesther vidal + george a mihaila,Querying Quality of Data Metadata80CF31F4,serenella ferro + rolf apweiler + hongzhan huang + darren a natale + claire odonovan + elisabeth gasteiger + nicole redaschi + michele magrane + brigitte boeckmann + laisu l yeh + maria martin + c h wu + amos bairoch + winona c barker + rodrigo lopez,The Universal Protein Resource (UniProt)0AD1A66A,h p grice,Logic and conversation Syntax and Semantics7C67E413,sharad mehrotra + dmitri v kalashnikov,Domain-independent data cleaning via analysis of entity-relationship graph7AB43B96,david e culler + scott shenker + neil patel + philip levis,Trickle: a self-regulating algorithm for code propagation and maintenance in wireless sensor networks7E617DD0,minyen kan,Web Page Categorization without the Web Page7D76F337,ling feng + arthur h van bunningen + peter m g apers,A context-aware preference model for database querying in an ambient intelligent environment08E18433,kostas g anagnostakis + p akritidis + evangelos p markatos,Efficient content-based fingerprinting of zero-day worms7D1C8F42,gerhard weikum + peter zabback + christof hasse + axel moenkeberg,Self-tuning database technology and information services: from wishful thinking to viable engineering79958A23,like gao + x sean wang,Continually evaluating similarity-based pattern queries on a streaming time series59D3037F,katherine m sharkey + mary a carskadon + avi sadeh,Activity-based sleep-wake identification: an empirical test of methodological issues.78CEBF01,piero a bonatti + maria luisa sapino + sibel adali + v s subrahmanian,A multi-similarity algebra76FAA7A8,j r paul hanna + r j millar + wesley m johnston,Advances in dataflow programming languages5CB1FDD8,nikos koudas + ibrahim kamel + christos faloutsos,Declustering Spatial Databases on a Multi-Computer Architecture60ACE705,miron livny + gaurang mehta + karan vahi + meihui su + jim blythe + ewa deelman + yolanda gil + carl kesselman + sonal patil,Pegasus: Mapping Scientific Workflows onto the Grid75E8B886,iadh ounis + vassilis plachouras + victor carneiro + fidel cacheda,Performance analysis of distributed information retrieval architectures using an improved network simulation model79A80169,carl kesselman + ian foster,The Grid 2: Blueprint for a New Computing Infrastructure7FC96939,amihai motro,BAROQUE: a browser for relational databases755D5DD0,phokion g kolaitis,"Schema mappings, data exchange, and metadata management"7D66321D,lucian popa + cong yu,Constraint-based XML query rewriting for data integration7AEBC021,adam berger + john lafferty,Information retrieval as statistical translation1401B48D,jamie callan + jie lu,Federated Search of Text-Based Digital Libraries in Hierarchical Peer-to-Peer Networks5C530877,ron weber,Information Systems Control and Audit7770DD28,tetsuya sakai + k sparckjones,Generic summaries for indexing in information retrieval81607ADC,vanja josifovski + ziv baryossef + marcus fontoura,On the memory requirements of XPath evaluation over XML streamsNE18021,l. sweeney,uniqueness of simple demographics in the u.s632B6FA2,chang r luo + hetal thakkar + yijian bai + carlo zaniolo,Efficient Support for Time Series Queries in Data Stream Management Systems8123C0ED,yanlei diao + s m a j rizvi + eugene wu,High-performance complex event processing over streams75B55162,murthy v devarakonda + john t robinson,Data cache management using frequency-based replacement7B826F83,hyoseop shin + sukho lee + bongki moon,Adaptive multi-stage distance join processing7FA37BA5,adi shamir,How to share a secret58BC50AB,peter triantafillou + christian zimmer + matthias bender + gerhard weikum + sebastian michel,P2P Content Search: Give the Web Back to the People763A2CC4,jiong yang + philip s yu + haixun wang + wei wang,Clustering by pattern similarity in large data sets78DE7135,k r j smettem + kevin mayer + rachel cardelloliver + mark kranz,A Reactive Soil Moisture Sensor Network: Design and Field Evaluation755CDA12,zhijun zhan + wenliang du,Using randomized response techniques for privacy-preserving data mining7D3E0FD6,jeffrey xu yu + zhixian li + hongjun lu + ling feng,Fully Dynamic Partitioning: Handling Data Skew in Parallel Data Cube Computation8068DF20,elke a rundensteiner + yunwu huang + ning jing,Hierarchical encoded path views for path query processing: an optimal model and its performance evaluation5D749019,sameet agarwal + prasad m deshpande + raghu ramakrishnan + jeffrey f naughton + ashish gupta + sunita sarawagi + rakesh agrawal,On the Computation of Multidimensional AggregatesNE23723,"quinlan. j.r, c",5: programs for machine learning7928FA16,moshe y vardi,Querying logical databases0513DE10,flavio rizzolo + alberto o mendelzon,Indexing XML Data with ToXin77260DB5,sabine massmann + honghai do + erhard rahm + david aumueller,Schema and ontology matching with COMA++7ED2F52A,alberto montresor + hein meling + ozalp babaoglu,Anthill: a framework for the development of agent-based peer-to-peer systems595AB64F,kaushik chakrabarti + sharad mehrotra,Local Dimensionality Reduction: A New Approach to Indexing High Dimensional Spaces7D1F7665,adam cheyer + john park + richard donald giuli,"IRIS: Integrate, Relate. Infer. Share."NE35278,a. datta,proxy-based acceleration of dynamically generated content on the world wide web: an approach and implementationNE35271,"l. wang, e. a. rundensteiner, and m. mani",u-filter: a full-fledged xml-to-relational update translatability checking frameworkNE35270,l. wang and e. a. rundensteiner,on the updatability of xquery views published over relational dataNE35273,m. k. jaber and a. voronkov,implementation of unidoor: a deductive object-oriented database system (submittedNE35275,a. voronkov,"unidoor, a deductive object oriented data model"5E43C583,carla e brodley + jennifer g dy,Feature Subset Selection and Order Identification for Unsupervised Learning78753868,erik christensen + francisco curbera + greg meredith + sanjiva weerawarana,Web Services Description Language (WSDL) 1.17CF97E85,duenren liu + shashi shekhar,CCAM: a connectivity-clustered access method for networks and network computations7E0F7E6A,gurmeet singh manku + sridhar rajagopalan + bruce lindsay,Random sampling techniques for space efficient online computation of order statistics of large datasets0730570D,rohan murty + matt welsh,Towards a dependable architecture for internet-scale sensing75665DE4,hanspeter kriegel + martin pfeifle,Density-based clustering of uncertain data087B16E3,sanjiva weerawarana + william nagy + francisco curbera,Web Services: Why and How7D14902B,adegbemiga ola + gultekin ozsoyoglu,Incomplete relational database models based on intervalsNE34056,"s. madden, w. hong, j. m. hellerstein, and m. franklin",tinydb web pageNE34057,moteiv,telos revb datasheetNE34054,p. levis and,fire alert-and-response system prototypeNE34055,s. madden,intel lab dataNE34052,s. m. graham cormode,minos garofalakis and rNE34050,"a. deshpande, c. guestrin, and s. madden",using probabilistic models for data management in acquisitional environments58C396F9,charles k chui,An introduction to wavelets4830FC86,onur kutlubay,DESIGN AND IMPLEMENTATION OF A RELIABLE RISK ASSESSMENT TECHNIQUE FOR SOFTWARE PROJECTS7FD019C4,jeanne ferrante + karl j ottenstein + joe warren,The program dependence graph and its use in optimization63BDCF39,bjajesh goyal + shashi shekhar + andrew fetterer,Materialization Trade-Offs in Hierarchical Shortest Path Algorithms82192DBA,leslie lamport,Paxos Made Simple58AD11D1,jose galindo + r carrasco + maria amparo vila miranda,FSQL: A Flexible Query Language for Data MiningNE36569,"n. beckmann, h.-p. kriegel, r. schneider, and b. seeger",the r-tree: an efficient and robust access method for points and rectanglesNE35181,ouozhu dong and jinyan li,efficient mining of emerging patterns: discovering trends and differencesNE35180,"surajit chaudhuri. usama m. fayyad, and jeff bernhardt",scalable classification over sql databasesNE35187,"r. meo, o. psaila, and s. ceri",a new sql-like operator for mining association rules7FD4CA46,jayant r kalagnanam + marlon dumas + quan z sheng + liangzhao zeng + boualem benatallah,Quality driven web services compositionNE35184,rooming jin and gagan agrawal,a systematic approach for optimizing complex mining tasks on multiple datasetsNE36560,the p-grid consortium,the p-grid projectNE36561,m. r. yong yang,rocky dunlap and b0574ABFA,yunwu huang + jing ning + elke a rundensteiner,Spatial Joins Using R-trees: Breadth-First Traversal with Global OptimizationsNE35188,"rosa meo. marco botta, and roberta esposito",query rewriting in itemset miningNE36564,"l. girod, t. stathopoulos, n. ramanathan, j. elson, d. estrin, e. osterweil, and t. schoellhammer","a system for simulation, emulation, and deployment heterogeneous sensor networks"NE36565,p. levis,tossim: accurate and scalable simulation of entire tinyos applicationsNE36566,"p. levis, n. patel, d. culler, and s. shekner",trickle: a self-regulating algorithm for code propagation and maintenance in wireless sensor networks5F38DBBC,hannu toivonen,Sampling Large Databases for Association RulesNE34637,iso/iec,information technology-database language-sql-part 2: foundation (sql/foundationNE34635,s. helmer and g. moerkotte,compiling away set containment and intersection joins7D2F0F7B,mansur r kabuka + akmal a younis + haifeng xu,Automatic moving object extraction for content-based applicationsNE34638,iso/iec,information technology-database language-sql-part 2: framework (sql/framework58DB3312,david g stork + peter e hart + richard o duda,Pattern Classification (2nd Edition)04E89E5B,eamonn j keogh,UCR Time Series Data Mining Archive779D17C8,eamonn keogh + shruti kasetty,On the need for time series data mining benchmarks: a survey and empirical demonstration76B50E69,george karypis + v kumar + euihong han,Scalable parallel data mining for association rules7634E54A,yingwei cui + janet l wiener + jennifer widom,Tracing the lineage of view data in a warehousing environmentNE14841,weblink,"r. kohavi, d. sommerfield, and j. dougherty"5A580089,claus hagen + gustavo alonso,Geo-Opera: Workflow concepts for spatial processes7E9C2C61,van jacobson,Congestion avoidance and control7D78BD7A,kajiro watanabe + takashi watanabe,Noncontact method for sleep stage estimation804965C6,igor tatarinov + peter mork + alon halevy + zachary g ives,Piazza: data management infrastructure for semantic web applications8158761D,andreas tolk,What Comes After the Semantic Web - PADS Implications for the Dynamic Web7F7B67B0,nick roussopoulos + chungmin melvin chen,Adaptive selectivity estimation using query feedback5EA2F6E9,les clewlow + chris strickland,Energy derivatives : pricing and risk management5F8CED15,john a miller + amit p sheth + preeda rajasekaran + kunal verma,Enhancing Web Services Description and Discovery to Facilitate Composition77144285,edward r tufte,"Visual explanations: images and quantities, evidence and narrative"5A6E3B10,kenneth l mcmillan,Symbolic model checking: an approach to the state explosion problem7BA8FFAC,stephen e fienberg + yvonne m m bishop + paul w holland,Discrete multivariate analysis : theory and practiceNE31035,"a. rowstron, p. druschel",pastry: scalable distributed object location and routing for large-scale peer-to-peer systemsNE31032,weblink,napster8124961B,qing zhang + nick koudas + ting yu + divesh srivastava,Aggregate Query Answering on Anonymized Tables028360D4,clyde l monma + jeffrey b sidney,Sequencing with seriesparallel precedence constraints7FD73356,srinivasan parthasarathy + matthew eric otey + gangmin li + dhabaleswar k panda + s narravula + amol ghoting,Towards NIC-based intrusion detection7E1CE3A2,david maier,The theory of relational databases7B147CAD,ian taylor + matthew shields + shalil majithia + ian wang,Triana: a graphical Web service composition and execution toolkit7A97DFB7,marco gruteser + dirk grunwald,Anonymous Usage of Location-Based Services Through Spatial and Temporal Cloaking78C6ED89,jon kleinberg,Bursty and hierarchical structure in streamsNE19132,"nanopoulos a, theodoridis y, manolopoulos y",c2p: clustering based on closest pairs804D894E,geoffrey zweig + steven c glassman + mark manasse + andrei broder,Syntactic clustering of the WebNE35866,"c. re, n. dalvi, and d. suciu",efficient top-k query evaluation on probabilistic data (extended versionNE35867,s. e. f. william w. cohen,pradeep ravikumarNE35860,n/a,weblinkNE35862,"j. branke, s. chick, and c. schmidt",new developments in ranking and selection: an empirical comparison of three main approachesNE35863,d. goldsman and b. nelson,satistical selection of the best system0303B60C,mathieu roche + zohra bellahsene + fabien duchateau,A Context-based Measure for Discovering Approximate Semantic Matching between Schema Elements00CFB54F,patrick saffar,5 x 27FD69E59,michael j franklin + sirish chandrasekaran,Streaming queries over streaming data7D88FBE8,david wagner,Resilient aggregation in sensor networks7E0ED20D,byron dom + soumen chakrabarti + martin van den berg,Focused crawling: a new approach to topic-specific Web resource discovery7F737D6B,quan z sheng + anne h h ngu + marlon dumas + boualem benatallah,Declarative composition and peer-to-peer provisioning of dynamic Web services8055A4D7,michael m wagner + fuchiang tsui + j hutman + jeremy u espino + per h gesteland + virginia dato,Technical description of RODS: a real-time public health surveillance system26312B6B,日経linux,ラズパイマガジン : 超基本からサーバー構築、面白工作まで!7C0BB6F0,paulo martins engel + luis otavio alvares + sandro da silva camargo + vania bogorny,Mining frequent geographic patterns with knowledge constraints810A74AA,li ding + lina zhou + anupam joshi + tim finin,How the Semantic Web is Being Used: An Analysis of FOAF Documents5A56D9CB,bernhard seeger + hanspeter kriegel,Techniques for Design and Implementation of Efficient Spatial Access Methods0B8C267E,vahab s mirrokni + nicole immorlica + piotr indyk + mayur datar,Locality-sensitive hashing using stable distributions768B6FEB,zhilin li + stan openshaw,Algorithms for automated line generalization 1 based on a natural principle of objective generalization7E401BC9,matthew younglai + ivan t bowman + brendan lucier + john smirnios + daniel j farrar + anil k goel + g n paulley + anisoara nica + peter bumbulis,SQL Anywhere: A Holistic Approach to Database Self-management7A57E78A,william w cohen,Data integration using similarity joins and a word-based information representation language7EF9F747,john mylopoulos + nicola zannone + fabio massacci + paolo giorgini,"Modeling security requirements through ownership, permission and delegation"81382C74,vivek narasayya + surajit chaudhuri + sanjay agrawal + abhinandan das,Automating layout of relational databases80A7D726,david t mcwherter + anastassia ailamaki + mor harcholbalter + bianca schroeder,Priority mechanisms for OLTP and transactional Web applications7F32845F,martin j strauss + yannis kotidis + anna c gilbert + s muthukrishnan,One-pass wavelet decompositions of data streams5B0B8BB7,sang v nguyen + robert h mcguckin,Public Use Microdata: Disclosure and Usefulness7E5E49B3,surajit chaudhuri + luis gravano + nicolas bruno,STHoles: a multidimensional workload-aware histogram7EF6BE8C,ramakrishnan srikant + johannes gehrke + alexandre evfimievski,Limiting privacy breaches in privacy preserving data mining59BE5F8B,maurice h halstead,Elements of software science80D95B1D,pradeep shenoy + philip bohannon + raghav kaushik + ehud gudes,Exploiting local similarity for indexing paths in graph-structured data5C59AFF9,jimeng sun + bin liu + yufei tao + dimitris papadias,"Querying about the Past, the Present, and the Future in Spatio-Temporal"NE36369,a. papoulis,probabilityNE36365,"w. j. krzanowski, and f. h. c. marriott",multivariate analysis part 2: classificationNE36362,"p. horton, and k. nakai",a probablistic classification system for predicting the cellular localization sites of proteins5CF4786C,damyan ognyanoff + dimitar manov + miroslav goranov + atanas kiryakov + angel kirilov + borislav popov,KIM – Semantic Annotation Platform7FC0EB43,raymond j mooney + mary elaine califf,Relational learning of pattern-match rules for information extractionNE34427,"x. meng, l. li, t. nandagopal, and s. lu",event contour: an efficient and robust mechanism for tasks in sensor networks7F26768D,bing liu + wee sun lee,Learning with Positive and Unlabeled Examples Using Weighted Logistic Regression7D8C39EE,musa h asyali + omer demirkaya + mohamed shoukri,Segmentation of cDNA Microarray Spots Using Markov Random Field Modeling7ED36189,martin ester + jian pei + wen jin + yufei tao,Catching the best views of skyline: a semantic approach based on decisive subspacesNE34350,s. chandrasekharan,telegraphcq: continuous dataflow processing for an uncertain world7F7AFD0C,lei jiang + john mylopoulos + thodoros topaloglou + alexander borgida,Incorporating Goal Analysis in Database Design: A Case Study from Biological Data ManagementNE34421,p. b. gibbons and y. matias,new sampling-based summary statistics for improving approximate query answers76192362,harry t hsu,An Algorithm for Finding a Minimal Equivalent Graph of a Digraph800F9357,p bunenan,The two cultures of digital curationNE34805,"s. rinderle, a. wombacher, and m. reichert",on the controlled schema evolution of process choreographiesNE34807,"a. wombacher, p. fankhauser, and e. neuhold",transforming bpel into annotated deterministic finite state automata enabling process annotated service discoveryNE34800,"f. casati, s. ceri, b. pemici, and g. pozzi",workflow evolution7FA7B1A1,james joshi + usman latif + elisa bertino + arif ghafoor,A generalized temporal role-based access control model77744C4C,aristides gionis + rajeev motwani + piotr indyk + mayur datar,Maintaining Stream Statistics over Sliding Windows7DECF2FC,fang bian + christophe diot + wei hong + hui zhang + xin li + g lannaccone + ramesh govindan,Advanced Indexing Techniques for Wide-Area Network Monitoring80D95AE4,herbert w hethcote,The Mathematics of Infectious Diseases0320F157,donna harman,Overview of the First Text REtrieval Conference76E1AFCF,goetz graefe + karen ward,Dynamic query evaluation plans7A2E74B7,franco p preparata + fabrizio luccio + h t kung,On Finding the Maxima of a Set of Vectors5A7FA8F2,matthew roughan + michael rumsewicz + charles robert kalmanek + albert greenberg + yin zhang + jennifer yates,"Experience in measuring internet backbone traffic variability: Models metrics, measurements and meaning"NE35104,trusted computing group,tcg specification architecture overviewNE36771,revolutionizing science and engineering through cyberinfrastructure: report of the national,science foundation blue-ribbon advisory panel on cyberinfrastructureNE36770,k. l. mills,computer-supported cooperative workNE36773,charu c. aggarwal. on,k-anonymity and the curse of dimensionality85E8A6F5,ouri wolfson + sam chamberlain + fengli zhang + goce trajcevski,The geometry of uncertainty in moving objects databases7EAADE3A,yingli tian + jeffrey f cohn + takeo kanade,Comprehensive database for facial expression analysis5B9AA4D0,junichi akahani + tetsuji satoh + yutaka yanagisawa,Shape-Based Similarity Query for Trajectory of Mobile Objects802931C7,beng chin ooi + kianlee tan + wee siong ng,BestPeer: a self-configurable peer-to-peer system5E307F06,fabio ciravegna + mattia lanzoni + arthur stutt + enrico motta + john domingue + maria vargasvera,MnM: Ontology Driven Semi-automatic and Automatic Support for Semantic Markup00D0BAE2,francois bry + sebastian schaffert,Querying the Web Reconsidered: A Practical Introduction to Xcerpt80CBA2E1,david l walker,A type system for expressive security policies7DA8E2AF,philip a bernstein + paolo atzeni + paolo cappellari,ModelGen: model independent schema translation5AFF7B4C,nick roussopoulos + zhexuan song,K-Nearest Neighbor Search for Moving Query Point7F762D89,alex pentland + matthew j turk,Eigenfaces for recognition7EDCD8B1,shurug alkhalifa + cong yu + h v jagadish,Querying structured text in an XML database7A780210,spiros papadimitriou + p yu,Optimal multi-scale patterns in time series streams7E2346DE,traian marius truta + bindu vinay,Privacy Protection: p-Sensitive k-Anonymity Property7E7DD06B,haixun wang + carlo zaniolo,Query languages and data models for database sequences and data streams5E90147F,mariechristine rousset + alexandre termier + michele sebag,Dryade: a new approach for discovering closed frequent trees in heterogeneous tree databases7702BE80,robert a wagner + stuart e dreyfus,The steiner problem in graphs73040F8F,claudio bettini + x sean wang + sushil jajodia,Protecting privacy against location-based personal identification5F7EAD8A,peter boncz + martin kersten + stefan manegold,What Happens During a Join? Dissecting CPU and Memory Optimization EffectsNE35518,s. chaudhuri and g. weikum,rethinking database system architecture: towards a self-tuning rise-style database systemNE35046,"r. j. miller, y. e. ioannidis, r",ramakrishnan: schema equivalence in heterogeneous systems: bridging theory and practiceNE35047,"y. huang, h",garcia-molina: publish/subscribe in a mobile environmentNE35044,"l. m. haas, m. a. hernandez, h. ho, l. popa, m.roth: clio grows up: from research prototype to industrial tool",sigmod 2005: 805-810NE35045,r,hull: managing semantic heterogeneity in databases: a theoretical perspective5EEB4FCD,luping ding + elke a rundensteiner + george t heineman + nishant mehta,Joining Punctuated StreamsNE35043,"p. a. bernstein, a. y. halevy, r",pottinger: a vision of management of complex modelsNE35041,"r. sugden, t. smith",cochran's rule for simple random sampling59756038,wangchiew tan,Containment of Relational Queries with Annotation Propagation7E24E539,frank stajano + alastair r beresford,Location privacy in pervasive computing60497AC7,david w embley + muhammed almuhammed,Resolving Underconstrained and Overconstrained Systems of Conjunctive Constraints for Service Requests7FA482C2,vern paxson,End-to-end routing behavior in the Internet6B861FBA,john mylopoulos + yuan an + alexander borgida,Discovering the Semantics of Relational Tables Through Mappings02E622CF,p greasley,Representation of prosodic and emotional features in a spoken language database77DF4A5D,szechung ngan + tsang lam + raymond chiwing wong + ada waichee fu,Mining N-most interesting itemsets without support threshold by the COFI-tree7C9990D4,odysseas g tsatalos + marvin h solomon + yannis ioannidis,The GMAP: a versatile tool for physical data independence7B1E945A,sunil prabhakar + yicheng tu + bin yao + song liu,Load shedding in stream databases: a control-based approach7E1E1795,donald kossmann + peter m fischer,Batched processing for information filtersNE14988,"g. cormode, m. datar, p. indyk, and s. muthukrishnan",comparing data streams using hamming normsNE14982,j. a. neider and r. mead,a simplex method for function minimization8006BC05,yun chi + yirong yang + richard r muntz,Indexing and mining free trees5959ADE7,christos faloutsos + rakesh agrawal + arun n swami,Efficient Similarity Search In Sequence Databases5DCAB453,dennis shasha + vladimir lanin,A symmetric concurrent B-tree algorithm7D1F730E,david slepian + jack k wolf,Noiseless coding of correlated information sources7CC6651E,chengcui zhang + shuching chen + min chen + meiling shyu,A unified framework for image database clustering and content-based retrieval811B4FC3,hanspeter kriegel + thomas seidl,Efficient User-Adaptable Similarity Search in Large Multimedia Databases59AB35EF,shurug alkhalifa + yuqing wu + andrew nierman + stelios paparizos + h v jagadish + laks v s lakshmanan + divesh srivastava,Grouping in XML7A2288A6,viggo kann + edoardo amaldi,The complexity and approximability of finding maximum feasible subsystems of linear relations079120ED,p faioutsos + c faioutsos + m faioutsos,On powerlaw relationships of the internet topology