paper_index,authors,title7CB0DB85,vanja josifovski + marcus fontoura + ziv baryossef,On the memory requirements of XPath evaluation over XML streams7FADECE9,sagit zohar + tova milo,Using Schema Matching to Simplify Heterogeneous Data Translation58850AB6,nick koudas + divesh srivastava,Data stream query processing: a tutorial75651137,william h wolberg + o l mangasarian,Multisurface method of pattern separation for medical diagnosis applied to breast cytology.041760A6,karun bakshi + david f huynh + david r karger + vineet sinha + dennis quan,Haystack: A General-Purpose Information Management Tool for End Users Based on Semistructured Data7EB48353,frank wm tompa + jose a blakeley + perake larson,Efficiently updating materialized views80AB95DF,muhammad s hussain + f mohdyasin + m b raez,"Techniques of EMG signal analysis: detection, processing, classification and applications."854524B7,michael garland + paul s heckbert,Surface simplification using quadric error metrics7D91609D,tore risch + milena ivanova,Customizable parallel execution of scientific stream queriesNE32506,weblink,sax: simple api for xml5BA266DE,yuqing wu + jignesh m patel + h v jagadish,Estimating Answer Sizes for XML Queries854807,stefano lodi + gianluca moro + matthias klusch,Distributed clustering based on sampling local density estimates815FAD14,zhenghong zhao + nidal zeidat + christoph f eick,Supervised clustering - algorithms and benefits8130AA87,graham cormode + s muthukrishnan,What's new: finding significant differences in network data streamsNE35878,m. de berg,in computational geometryNE35876,weblink,rfid journalNE35871,"h. su, e. a. rundensteiner, and m. mani",semantic query optimization for xquery over xml streams81592338,paramvir bahl + venkata n padmanabhan,RADAR: an in-building RF-based user location and tracking system80CD9BD4,tim menzies + jeremy greenwald + a d frank,Data Mining Static Code Attributes to Learn Defect Predictors7D0CC8AB,rachel pottinger + alon halevy,MiniCon: A scalable algorithm for answering queries using views8146DFD5,amr el abbadi + divyakant agrawal + abhishek gupta + ozgur d sahin,Meghdoot: content-based publish/subscribe over P2P networks04D32102,gerhard weikum + gottfried vossen,Transactional information systems---theory7E9F377C,gabi kastenmuller + hanspeter kriegel + thomas seidl + mihael ankerst,Nearest Neighbor Classification in 3D Protein DatabasesNE31971,"s. melnik, h. garcia-molina, and e. rahm",similarity flooding: a versatile graph matching algorithm7.69E+71,ginestra bianconi + matteo marsili,Loops of any size and Hamilton cycles in random scale-free networks5954C0EB,jiawei han + benjamin w wah + xiaolei li + dong xin,Star-cubing: computing iceberg cubes by top-down and bottom-up integration7E6FC9D7,william j kaiser + gregory j pottie,Wireless integrated network sensors0AE5CA6E,daniel jurafsky + james harry nicholas martin,Speech and Language Processing7913D388,patrick bosc,On the primitivity of the division of fuzzy relations7E3E75B4,ronald fagin + edward l wimmers,A formula for incorporating weights into scoring rules5DA0130D,ian goldberg,"Privacy-enhancing technologies for the internet, II: five years later"5D038677,kevin murphy + yair weiss + michael i jordan,Loopy belief propagation for approximate inference: an empirical study0866D404,abhinav kamra + vishal misra + erich m nahum,Yaksha: a controller for managing the performance of 3-tiered websites792B5B3B,francis y l chin + qizhi fang + shanfeng zhu + xiaotie deng,Approximate and dynamic rank aggregation5C07A713,yuval elovici + erez shmueli + ronen waisenberg + ehud gudes,A Structure Preserving Database Encryption Scheme6593DADD,ke deng + xiaofang zhou,Expansion-Based algorithms for finding single pair shortest path on surface5D3C2879,lisa mcclain + kevin loney,Oracle Database 10g The Complete ReferenceNE36370,a. papoulis,probability & statisticsNE36372,"k. rose, e. gurewitz, and g. c. foz",constrained clustering as an optimization methodNE36377,"m. zhao, alan m. n. fu, and h. yan",a technique of three-level thresholding based on probability partition and fuzzy 3-partitionNE36379,s. amer-yahia and,"flexpath: flexible structure and full-text querying, for xml"7F1747C0,alexander maedche + steffen staab,Ontology learning for the Semantic WebNE36060,"j. galindo, a. urrutia, and m. piattini",fuzzy databases: modeling5A513336,awais rashid,On to Aspect Persistence5A241E7C,chaokun wang + shengfei shi + jianzhong li,A music data model and its application7D58DAC6,haibo hu + dik lun lee,Range nearest-neighbor query814077A1,david j dewitt + jim gray,Parallel Database Systems: The Future of High Performance Database Processing788629A5,liisa holm + chris sander,Protein Structure Comparison by Alignment of Distance Matrices754C87CA,anna r karlin + thomas anderson + david wetherall + stefan savage,Practical network support for IP traceback5E94C0AE,bin he + tao tao + kevin chenchuan chang,"Clustering Structured Web Sources: A Schema-Based, Model-Differentiation Approach"78DD0B5D,ronald fagin + d sivakumar + ravi kumar,Comparing top k lists7FC0285F,richard d sisson + aparna s varde + mohammed maniruzzaman + elke a rundensteiner + carolina ruiz,LearnMet: learning domain-specific distance metrics for plots of scientific functionsNE33820,e. zegura,how to model an internetworkNE34838,"dong. x, halevy, a, madhavan, j",2005)  reference reconciliation in complex information spacesNE34839,"sarawagi, s","2000)  special issue on data cleaning  bulletin of the tech  committee on data eng,  ol"NE34830,"hristidis, v. papakonstantinou, y",2002)  discover: keyword search in relational databasesNE34831,"hristidis. v, gravano, l, papakonstantinou, y",2003)  efficient ir-style keyword search over relational databasesNE34832,"collins. a, quillian, m",1969)  retrieval time from semantic memoryNE34833,"koutrika. g, ioannidis, y",2005)  personalized queries under a generalized preference modelNE34834,"guo. l, shao, f, botev, c, shanmugasundaram, j",2003)  xrank: ranked keyword search over xml documentsNE34835,"hristidis. v, papakonstantinou, y, balmin, a",2003)  keyword proximity search on xml graphsNE34836,weblink,oracle 9i textNE34837,ms sql server,url: msdn.microsoft.com/libraryNE36832,"h. -j. lenz, and a. shoshani",summari zabili ty7FC5FF18,walid g aref + ihab f ilyas + ahmed k elmagarmid,Supporting top- k join queries in relational databasesNE36740,"h. j. steenhagen, p. m. g. apers, h. m. blanken, and r. a. de by",from nested-loop to join queries80A6FDDC,paul tompkins + william whittaker + anthony stentz,Mission planning for the Sun-Synchronous Navigation Field Experiment7EAF0458,wangchiew tan + sanjeev khanna + peter buneman,On propagation of deletions and annotations through views6778C136,j veizades + martin v day + erik guttman + charles e perkins,"Service Location Protocol, Version 2"813A9E0E,r p logan + kentaro toyama + asta roseway,Geographic location tags on digital images7FA8653E,hari balakrishnan + magdalena balazinska + michael stonebraker + samuel madden,Fault-tolerance in the Borealis distributed stream processing system5B321B2C,dorian pyle,Data preparation for data mining813733F0,yaqin zhang + y t hou + dapeng wu,Scalable video coding and transport over broadband wireless networks0685F731,jeffrey frey + carl kesselman + david snelling + t maquire + p vanderbilt + stephen m graham + ian foster + t standholm + steven tuecke + karl czajkowski,Open grid services infrastructure (ogsi) version 1. 003EB804E,donald kossmann + daniela florescu,Storing and Querying XML Data using an RDBMS5F671C0F,mohammad r kolahdouzan + mehdi sharifzadeh + cyrus shahabi,A Road Network Embedding Technique for K-Nearest Neighbor Search in Moving Object Databases8168CD1A,gang qian,Principles and applications for supporting similarity queries in non-ordered-discrete and continuous data spaces5BBB0A25,samrat bhattacharjee + kenneth l calvert + ellen zegura,On Active Networking and Congestion7DB03453,amihai motro,VAGUE: a user interface to relational databases that permits vague queries7D9AF79E,elena ferrari + elisa bertino,Secure and selective dissemination of XML documentsNE34144,g. ramakrishnan,word associations in text mining7FBF3AD1,cristina videira lopes + lodewijk bergmans,Aspect-Oriented ProgrammingNE35572,steven p. reiss. constraining software evolution,proceedings of the international conference on software maintenance (icsm'0275234255,beng chin ooi + yanfeng shu + kianlee tan,Relational data sharing in peer-based data management systems7BC3461D,ralf hartmut guting + victor teixeira de almeida,Supporting uncertainty in moving objects in network databases80324B76,utkarsh srivastava + volker markl + marcel kutsch + t m tran + peter j haas,ISOMER: Consistent Histogram Construction Using Query Feedback63715DDE,stanley b zdonik + mark palmer,Fido: A Cache That Learns To Fetch5CBFD910,renee j miller + laura m haas + mauricio hernandez,Schema Mapping as Query DiscoveryNE35054,weblink,n/aNE35056,melissa k. carroll and s.-h. cha,application of stacked generalization to a protein localization prediction taskNE35059,"a. dobra, m. n. garofalakis, j. gehrke, and r. rastogi",processing complex aggregate queries over data streamsNE35506,p. chan and s. stolfo,experiments on multistrategy learning by meta-leamingNE35504,k. schnaitter,colt: continuous on-line tuningNE35501,n. bruno and s. chaudhuri. physical design refinement: the,merge-reduce5E2DB6C1,michael j carey + miron livny + kurt p brown,Managing Memory to Meet Multiclass Workload Response Time GoalsNE34458,p. arzberger and t. a. finholt,report on data and collaboratories in the biomedical community workshopNE34459,weblink,revolutionizing science and engineering through cyberinfrastructure: report of the national science foundation blue-ribbon advisory panel on cyberinfrastructureNE34453,weblink,mypacsNE34450,t. keller and d. jones,metadata: the foundation of effective experiment managementNE34457,"i. altintas, c. berkley, e. jaeger, m. jones, b. ludscher, and s. mock",kepler: an extensible system for design and execution of scientific workflows7983F93A,hamid pirahesh + calisto zuzarte + qi cheng + wenbin ma + linqi liu + kwai wong,WinMagic: subquery elimination using window aggregation094D4444,fabio patern + alistair sutcliffe + alexander repenning,End-user Development5A066EE6,oliver g nther,Efficient computation of spatial joins5C128F14,alfons kemper + stefan seltzsam + martin wimmer + stefan krompass + daniel gmach + technische universitat munchen,Dynamic Load Balancing of Virtualized Database Services Using Hints and Load Forecasting706015CC,gregory d speegle + xiaojun wang + le gruenwald,A meta-structure for supporting multimedia editing in object-oriented databases80ADA81C,s r chidamber + chris f kemerer,A metrics suite for object oriented designNE36835,weblink,university of washington xml repository7B2FA87D,richard m karp + michael luby,Monte-Carlo algorithms for enumeration and reliability problems81D76997,hiroaki kato + yoshimasa takahashi,Automated Identification of Three-Dimensional Common Structural Features of Proteins7FD0FA7F,octavian procopiuc + jeffrey scott vitter + torsten suel + sridhar ramaswamy + lars arge,Scalable Sweeping-Based Spatial Join7C43A532,michael w blasgen + bradford w wade + bruce lindsay + g r putzolu + w f king + jim gray + thomas g price + raymond lorie + p g sellinger + morton m astrahan + j w mehl + mario schkolnick + donald r slutz + irving l traiger + h r strong + donald d chamberlin + robert a yost,System R: an architectural overview59073F83,prabhakar raghavan + jon kleinberg + christos h papadimitriou,A Microeconomic View of Data Mining7B12681A,mark dilman + danny raz,Efficient reactive monitoring77A0DBE4,tohru motooka + masaru kitsuregawa + hidehiko tanaka,Application of Hash to Data Base Machine and Its Architecture72E1F2FF,michael rys,Bringing the Internet to your database: using SQL server 2000 and XML to build loosely-coupled systems7B5D6387,moni naor + kobbi nissim,Communication preserving protocols for secure function evaluation5CF7BAE5,s de capitani di vimercati + ernesto damiani + supriyo de + pierangela samarati + claudio a ardagna,Towards Privacy-Enhanced Authorization Policies and Languages77AF1C54,anthony klug,Calculating constraints on relational expression5DB0E75F,phillip b gibbons + georgos siganos + michalis faloutsos + christos faloutsos + christopher r palmer,The Connectivity and Fault-Tolerance of the Internet Topology813FF46C,ian f akyildiz + erdal cayirci + weilian su + yogesh sankarasubramaniam,Wireless sensor networks: a survey7EDF05AB,alexandros labrinidis + jie xu,Replication-Aware Query Processing in Large-Scale Distributed Information Systems7F054A51,leslie lamport + k mani chandy,Distributed snapshots: determining global states of distributed systemsNE33598,"m. bawa, r. j. bayardo jr, r. agrawal",privacy-preserving indexing of documents on the networkNE33596,s. padmanabhan,multi-dimensional clustering: a new data layout scheme in db2NE33595,n/a,weblink7F3A350E,joseph w yoder + jeffrey barcalow,Architectural Patterns for Enabling Application Security7CE6F84B,piergiorgio bertoli + annapaola marconi + paolo traverso + marco pistore,Automated synthesis of composite BPEL4WS Web services8168BF1D,georg gottlob + reinhard pichler + christoph koch,XPath processing in a nutshell7D7F25EE,amit marathe + nick koudas + sudipto guha + divesh srivastava,Merging the results of approximate match operations814E5BD8,changtao qu + wolfgang nejdl,Interacting the Edutella/JXTA peer-to-peer network with Web services8058DB99,jun zhang + dimitris papadias + nikos mamoulis + yufei tao,An efficient cost model for optimization of nearest neighbor search in low and medium dimensional spaces7FB72BF0,mohamed f mokbel,Towards Privacy-Aware Location-Based Database Servers7DD14BF3,kobbi nissim + irit dinur,Revealing information while preserving privacy8134D444,vladlen koltun + christos h papadimitriou,Approximately dominating representatives01867B4F,sihem ameryahia + y l xu + divesh srivastava + mary fernandez,PIX: A System for Phrase Matching in XML Documents62ADC102,theodosios pavlidis,Algorithms for graphics and image processing7FE96850,il hong suh + jaehyun kim + frank chunghoon rhee,Convex-set-based fuzzy clustering6C55CB6F,moises goldszmidt + nir friedman + dan geiger,Bayesian Network ClassifiersNE36357,"g, h. demiroz, a. govenir, and n. liter",learning differential diagnosis of eryhemato-squamous diseases using voting feature intervals7AB96DAD,michael o rabin,"Efficient dispersal of information for security, load balancing, and fault tolerance"77424020,h v jagadish + christos faloutsos + king ip lin,The TV-tree: an index structure for high-dimensional data7FB36959,johannes gehrke + venkatesh ganti + raghu ramakrishnan,RainForest—A Framework for Fast Decision Tree Construction of Large Datasets5CD3DF27,dharmendra s modha + nimrod megiddo,Outperforming LRU with an adaptive replacement cache7A040CBD,sheldon j finkelstein + mario schkolnick + paolo tiberio,Physical database design for relational databases5CDAB8BA,mohamed ali + walid g aref + mohamed f mokbel + ahmed k elmagarmid + ibrahim kamel + abdelsalam helal + ranjan bose,Nile-PDT: a phenomenon detection and tracking framework for data stream management systems8057AFE2,min wang + lipyeow lim + jeffrey scott vitter,SASH: a self-adaptive histogram set for dynamically changing workloads016118AA,guido proietti + adriano di pasquale + enrico nardelli,An RP* Extension with Almost Constant Amortized Costs5A5B497F,jim gray + andreas reuter,Transaction Processing: Concepts and Techniques59006472,laks v s lakshmanan + sailaja parthasarathy,On Efficient Matching of Streaming XML Documents and Queries815CD2AF,taher h haveliwala,Topic-sensitive PageRank7FA74803,ming xiong + kamyiu lam + song han,A deferrable scheduling algorithm for real-time transactions maintaining data freshnessNE11904,"m. ester, h. kriegel, j. sander, x. xu",a density bsed algorithm for discovering clusters in large spatial databases with noiseNE11907,"wang, k, tay, s.h.w, liu and b",interestingness-based interval merger for numeric association rules7B4B9552,pierreolivier amblard + pierre borgnat + patrick flandrin,Stochastic discrete scale invariance78381778,thomas ziebermayr + stefan probst,Web service authorization framework7A314820,philip dart + justin zobel,Phonetic string matching: lessons from information retrieval0A429CD2,sumit roy + bing jiang + kenneth p fishkin + matthai philipose,I Sense a Disturbance in the Force: Unobtrusive Detection of Interactions with RFID-tagged Objects8112F4E7,wangchien lee + julian winter,KPT: a dynamic KNN query processing algorithm for location-aware sensor networks7F384551,dale kaiser + peter d karp + pedro romero + jonathan wagg + m l green + markus krummenacker,Computational prediction of human metabolic pathways from the complete human genome7668401C,michael collins,"Three generative, lexicalised models for statistical parsing"5E0E7ACD,ian horrocks,The FaCT System75356CBF,persi diaconis + kenneth s brown,Random walks and hyperplane arrangements7EBE38CA,jens lechtenborger + gottfried vossen + stefano rizzi + matteo golfarelli,Schema versioning in data warehouses: enabling cross-version querying via schema augmentation77E5EF8C,vana kalogeraki + demetrios zeinalipouryazti + dimitrios gunopulos,Exploiting locality for scalable information retrieval in peer-to-peer networks7A5DA934,rodney w johnson + john e shore,Axiomatic derivation of the principle of maximum entropy and the principle of minimum cross-entropy7E3E6E2D,fabrizio sebastiani,Machine learning in automated text categorization78AF8BCA,mauricio a hernandez + salvatore j stolfo,The merge/purge problem for large databases7EF3C679,bernard w silverman,Density estimation for statistics and data analysis7FA85B69,himanshu gupta + inderpal singh mumick,Incremental maintenance of aggregate and outerjoin expressions5EC23EF4,abraham bernstein + mark h klein,Searching for Services on the Semantic Web Using Process Ontologies80E2B287,stephen soderland,Learning Information Extraction Rules for Semi-Structured and Free Text75A19828,ebru ersan + alazel acheson + jose a blakeley + honggang zhang + christian kleinerman + beysim sezgin + jun fang + peter carlin + r venkatesh + mason k bendixen + balaji rathakrishnan + xiaowei jiang + gideon schaller,Hosting the .NET Runtime in Microsoft SQL server77561862,serge abiteboul + neoklis polyzotis + karl schnaitter + tova milo,COLT: continuous on-line tuning80306819,bertram ludascher + terence critchlow + anne h h ngu + shawn bowers,Enabling ScientificWorkflow Reuse through Structured Composition of Dataflow and Control-Flow59F7D916,giovanni maria sacco + mario schkolnick,A Mechanism for Managing the Buffer Pool in a Relational Database System Using the Hot Set Model7F852B1D,minos garofalakis + rajeev rastogi + sumit ganguly,Processing data-stream join aggregates using skimmed sketchesNE4531,Bingsheng He+Qiong Luo+Byron Choi,Cache-Conscious Automata for XML Filtering78AE24BE,claudio esperanca + gisli r hjaltason + frantisek brabec + hanan samet + frank dale morgan + houman alborzi + egemen tanin,Use of the SAND spatial browser for digital government applications5D510A88,gary e bolton + elena katok + axel ockenfels,How Effective are Online Reputation Mechanisms?77140A5B,brad karp + phillip b gibbons + yan ke + srinivasan seshan + suman nath,IrisNet: an architecture for a worldwide sensor Web7B867AED,takashi kanai + hiromasa suzuki,Approximate shortest path on a polyhedral surface based on selective refinement of the discrete graph and its applicationsNE35266,"v. p. braganholo, s. b. davidson, and c. a. heuser",from xml view updates to relational view updates: old solution to a new problemNE36089,c. m. christensen and m. e. raynor the innovator's solution: creating and sustaining successful growth,harvard business school pressNE35262,"a. u. tansel, j. clifford, s. k. gadia, a. segev, and r. t. snodgrass",temporal databases: theory592AF091,jennifer widom + arvind arasu,Resource sharing in continuous sliding-window aggregatesNE36083,"b.-w. chang, d. ungar",animation: fromNE36082,n/a,weblinkNE36081,n/a,weblinkNE36087,j. tidwell,designing interfacesNE36086,weblink,acm transactions on accessible computing7C990713,sumit ganguly + phillip b gibbons + avi silberschatz + yossi matias,Bifocal sampling for skew-resistant join size estimationNE34026,ibm,xml generatorNE34025,j. clark,the expat xml parserNE34024,"y. chen, s. b. davidson, and y. zheng",an efficient xpath streaming processor6632290,p s rao + bongki moon,Approximate Tree Pattern Counts over Streaming Labeled Trees7E366ABF,anastassia ailamaki + miron livny + yannis ioannidis,Scientific workflow management by database managementNE36554,"v. plachouras, b. he, and i. ounis",university of glasgow at trec2004: experiments in web7C5B6B4E,anupam gupta + francis zane,Counting inversions in listsNE36556,"i. podnar, m. rajman, t. luu, f. klemm, and k. aberer","beyond, term"5DB34068,miron livny + raghu ramakrishnan + praveen seshadri,The Design and Implementation of a Sequence Database SystemNE36550,"f. m. cuenca-acuna, c. peery, r. p. martin, and t. d. nguyen",planetp: using gossiping to build091D3750,jeanjulien aucouturier + fran ois pachet,Improving Timbre Similarity : How high's the sky ?7EAC7DD0,david j dewitt + jignesh m patel,Partition based spatial-merge joinNE35190,"y.n.law, c.r.luo, h.wang, and c.zaniol",atlas: a turing complete extension of sql for data mining applications and streamsNE35191,pub. l,107-204NE35192,"t. hartman, foley & lardner llp",the cost of being public in the era of sarbanes-oxleyNE35193,financial executives international (fei,sarbanes-oxley compliance costs exceed estimatesNE35194,n/a,cfr parts 210NE35195,committee of sponsoring organizations of the treadway commission,internal control - integrated frameworkNE35196,n/a,pcaob accounting standard noNE35197,material weakness. and .deficiency,are definedNE35199,canadian institute of chartered accountants,continuous auditing research report7B655617,quan wang + ralf rantzau + bernhard mitschang + leonard shapiro,Algorithms and applications for universal quantification in relational databases5D27904C,amr el abbadi + hakan ferhatosmanoglu + divyakant agrawal + i stanoi,Constrained Nearest Neighbor Queries7C88C788,raphael rom + ariel orda,Shortest-path and minimum-delay algorithms in networks with time-dependent edge-length06BDCD93,gustavo alonso + c mohan,Workflow Management Systems: The Next Generation Of Distributed Processing Tools7698751A,wencang zhao + p j phillips + rama chellappa + a rosenfeld,Face recognition: A literature surveyNE36648,d. burleson,new developments in oracle data warehousing7EA3EFF7,steve lawrence + c lee giles + michelangelo diligenti + frans coetzee + marco gori,Focused Crawling Using Context Graphs5B9DC74B,donald b rubin + roderick j a little,Statistical analysis with missing data (second edition)6D0B944F,cui tao + david w embley + stephen w liddle,Automatically Extracting Ontologically Specified Data from HTML Tables of Unknown Structure7DA7D466,jiawei han + xifeng yan,CloseGraph: mining closed frequent graph patterns81742B82,s sudarshan + soumen chakrabarti + varun kacholia + shashank pandit + r l desai + hrishikesh karambelkar,Bidirectional expansion for keyword search on graph databases80D4EAC8,alan halverson + f naughton + david j dewitt + jennifer l beckmann,A Comparison of C-Store and Row-Store in a Common Framework7DBC1F8C,mangala gowri nanda + satish chandra + vivek sarkar,Decentralizing execution of composite web services76B21AD1,daniel leifker + nick roussopoulos,Direct spatial search on pictorial databases using packed R-trees811BEB07,vipul kashyap + i budak arpinar + amit p sheth,"Relationships at the Heart of Semantic Web: Modeling, Discovering, and Exploiting Complex Semantic Relationships"622F0AA5,frank olken + doron rotem,Maintenance of materialized views of sampling queriesNE31024,weblink,gnutellaNE31026,weblink,kazaa5E86F9F2,judith masthoff,The Pursuit of Satisfaction: Affective State in Group Recommender SystemsNE31023,weblink,freenet739CB575,george kollios + marios hadjieleftheriou + dimitrios gunopulos + vassilis j tsotras,Efficient Indexing of Spatiotemporal ObjectsNE31028,weblink,limewire7D4F2C0D,maurice a w houtsma + arun n swami,Set-oriented data mining in relational databases7AD3FB14,makoto nagao + le viet hao + takashi matsuyama,A file organization for geographic information systems based on spatial proximity763DF834,jingyu yang + ziquan hong,Optimal discriminant plane for a small number of samples and design method of classifier on the plane7E3E7D49,dilys thomas + ramakrishnan srikant + rakesh agrawal,Privacy preserving OLAP7926F5AD,yannis theodoridis + timos sellis,A model for the prediction of R-tree performance7D0EDBCF,vana kalogeraki + demetrios zeinalipouryazti + dimitrios gunopulos,A local search mechanism for peer-to-peer networksNE35851,m. zhong,"an evaluation and comparison of current peer-to-peer full-text keyword search, techniques"810D3F0C,christoph koch + martin grohe + peter buneman,Path queries on compressed XML6F9D99BF,ernst ellmer + dieter merkl,Classifying software process models based on natural language descriptionsNE34853,weblink,n/a7D49625A,sushil jajodia + chao yao + x sean wang,Checking for k -anonymity violation by views6D2EC449,gopal pingali + ramesh jain,"Electronic Chronicles: Empowering Individuals, Groups, and Organizations"5F257400,margaret h dunham,Data Mining: Introductory and Advanced Topics7DD505BD,stavros s cosmadakis + christos h papadimitriou,Updates of Relational Views