paper_index,authors,title5E31A15C,hongfei guo + raghu ramakrishnan + perake larson,"Caching with good enough currency, consistency, and completeness"7F30BBE4,donald kossmann + michael j carey,Reducing the Braking Distance of an SQL Query EngineNE34975,weblink,n/a7E583784,emanuele pianta + paolo tonella + filippo ricca + christian girardi,Using keyword extraction for Web site clustering5D224E47,brubeck et al + arthur flexer + gerhard widmer + black jesus + elias pampalk + beach boys,Improvements of audio-based music similarity and genre classification71E4D5BC,mohammed k jaber + andrei voronkov,"Implementation of UNIDOOR, a deductive object-oriented database system"NE17159,"i. stanoi,m. riedewald, d. agrawal, and a. e. abbadi",discovery of influence sets in frequently updated databases58A3401D,viswanath poosala + yannis ioannidis,Estimation of Query-Result Distribution and its Application in Parallel-Join Load Balancing7E00A072,igor tatarinov + zachary g ives + dan suciu + alon halevy,Schema mediation in peer data management systemsNE34973,weblink,n/a7D63F0C2,stratis d viglas + jeffrey f naughton,Rate-based query optimization for streaming information sources78391131,amin vahdat + patrick reynolds,Efficient peer-to-peer keyword searching7D08C608,audun josang + colin boyd + roslan ismail,A survey of trust and reputation systems for online service provision593F4E3B,wangchiew tan + peter buneman + sanjeev khanna,Why and Where: A Characterization of Data Provenance5B50A8B2,deborah l mcguinness + james p rice + steven m wilder + richard fikes,An Environment for Merging and Testing Large Ontologies01563B0C,john keenleyside + alberto o mendelzon + kelly lyons + denilson barbosa,ToXgene: An extensible template-based data generator for XML7D6CB746,carl a waldspurger,Lottery and Stride Scheduling: Flexible Proportional-share Resource Management5AEE431E,gerhard weikum + gottfried vossen,"Transactional information systems: theory, algorithms, and the practice of concurrency control and recovery"NE36180,n/a,weblinkNE36181,"s. brin, r. motwani, j. d. ullman, and s. tsur",dynamic itemset counting and implication rules for market basket analysisNE36186,weblink,snort network intrusion detection system7D833147,nicolas bruno + surajit chaudhuri,Flexible database generatorsNE36185,"s. sen, o. spatscheck, and d. wang",accurate75F2F0E8,david mazieres + siddhartha annapureddy + michael j freedman,Shark: scaling file servers via cooperative cachingNE36189,m. attig and j. lockwood,sift: snort intrusion filter for tcp in symposium on high performance interconnects (hotiNE33911,"kanda runapongsa., jignesh m.patel, h.v.jagadish. yun chen, and shurug al-khalifa",michigan benchmark: towards xml query performance diagnosticsNE33916,"p. a. boncz, a. n. wilschut, and m. l. kersten",flattening an object algebra to provide performance7A5D02B7,shaula alexander yemini + robert e strom,Optimistic recovery in distributed systemsNE35507,w. bruce croft,combining approaches for information retrieval0852CB12,agnes voisard + michel scholl + philippe rigaux,Introduction to Spatial Databases: Applications to GIS7974DAA7,brian babcock + surajit chaudhuri + gautam das,Dynamic sample selection for approximate query processing76D744F3,donald kossmann + till westmann + sven helmer + guido moerkotte,The implementation and performance of compressed databases7FEF1D84,vladimir zadorozhny + tolga urhan + maria esther vidal + laura bright + louiqa raschid,Efficient evaluation of queries in a mediator for WebSources80A034E3,weibo gong + prashant shenoy + purushottam kulkarni,Scalable techniques for memory-efficient CDN simulations7B35491C,zvi m kedem + bruce naylor + henry fuchs,On visible surface generation by a priori tree structures58458F81,ludmila cherkasova + gianfranco ciardo,"Role of Aging, Frequency, and Size in Web Cache Replacement Policies"5AE8A829,zoe lacroix + mariaesther vidal + louiqa raschid,Efficient Techniques to Explore and Rank Paths in Life Science Data Sources813B5AA5,robert rockwell + alden w jackson + w t strayer + craig partridge + b schwartz + wenyi zhou,Smart Packets for active networks7FBB0DB9,huahai he + ambuj k singh,Closure-Tree: An Index Structure for Graph Queries7514CD49,goetz graefe + diane l davison,Dynamic resource brokering for multi-user query execution7F795E8F,karam gouda + mohammed j zaki,Efficiently mining maximal frequent itemsets7E67138A,phillip m fernandez,Red brick warehouse: a read-mostly RDBMS for open SMP platforms7F3DC257,ming li + murali mani + elke a rundensteiner + mingzhu wei,Processing Recursive XQuery over XML Streams: The Raindrop Approach7635667,pinar senkul,Modeling Composite Web Services by Using a Logic-based Language7F6BEE5B,michail salampasis + christos kouroupetroglou + athanasios manitsaris,A Semantic-web based framework for developing applications to improve accessibility in the WWW03EE5C07,kenneth salem + hector garciamolina,In proceedings of the acm sigmod international conference on management of data7EED1245,frank chiu + murali mani + wesley w chu + dongwon lee,NeT & CoT: translating relational schemas to XML schemas using semantic constraints78427B4F,zoubida kedad + mokrane bouzeghoub,Discovering view expressions from a multi-source information systemNE12050,s. tavazoie,systematic determination of genetic network architecture7D517044,stephen j taylor + ronald ashri + mike surridge + terry r payne + darren marvin,Towards a Semantic Web Security Infrastructure7ACC7F06,rakesh mohan + john r smith + chungsheng li,Scalable multimedia delivery for pervasive computing7D3A13B9,oren etzioni + oren zamir,Web document clustering: a feasibility demonstration76B9C0D4,elizabeth w brown + james w warnner,Automated name authority control7AE33E03,ronald fagin,Inverting schema mappings0252EE79,isidore rigoutsos + haim j wolfson,Geometric hashing: An introduction7E16DCE9,spiros skiadopoulos + christos giannoukos + timos sellis + panos vassiliadis + manolis koubarakis,Computing and Handling Cardinal Direction Information7755C861,douglas b terry + david goldberg + david a nichols + brian m oki,Continuous queries over append-only databases8056DCEF,kwanghoon kim,Workflow dependency analysis and its implications on distributed workflow systems7A00A2C9,rolf michelsen + knut magne risvik,Search engines and Web dynamics58C94E67,edward sciore + arnon rosenthal,Abstracting and Refining Authorization in SQL7CC13C48,jiong yang + jiawei han + yifan li,Clustering moving objects58743559,paola sebastiani + marco f ramoni,Robust Learning with Missing Data0A969661,igor tatarinov + peter mork + g zachary + alon halevy,Peer Data Management Systems: Infrastructure for the Semantic Web81186AAE,ramesh govindan + brad karp + sylvia ratnasamy + deborah estrin + li yin + fang yu + scott shenker,"Data-centric storage in sensornets with GHT, a geographic hash table"7F8AF715,peter spyns + m w pretorius + marielaure reinberger + walter daelemans,Automatic Initiation of an Ontology7DC569B3,baihua zheng + wangchien lee,DSI: A Fully Distributed Spatial Index for Location-Based Wireless Broadcast Services7AD6961E,joseph m hellerstein,Optimization techniques for queries with expensive methods5FA747C3,mitsuru ishizuka + adam jatowt,Summarization of dynamic content in web collections80BD4255,dennis g severance + guy m lohman,Differential files: their application to the maintenance of large databases7C395D05,peter e hart + richard o duda,Pattern classification and scene analysis813C4085,george karypis + michihiro kuramochi,An efficient algorithm for discovering frequent subgraphs80D7D606,ian h witten + john g cleary,Data Compression Using Adaptive Coding and Partial String Matching7DBA5489,eric s lander + hilary a coller + clara d bloomfield + james r downing + mignon l loh + jill p mesirov + pablo tamayo + michelle gaasenbeek + michael a caligiuri + donna k slonim + todd r golub + christine huard,Molecular Classification of Cancer: Class Discovery and Class Prediction by Gene Expression Monitoring06F40C20,sylvia ratnasamy + scott shenker + joseph m hellerstein,Range Queries over DHTs80087AF2,h v jagadish + christos faloutsos + flip korn,Efficiently supporting ad hoc queries in large datasets of time sequencesNE30740,n/a,weblink7752BAD0,didier dubois + henri prade + patrick bosc + olivier pivert,Flexible queries in relational databases—the example of the division operatorNE30747,weblink,the niagara system7FDD48E5,wensyan li + quoc vu + dharma p agrawal + k s candan,Query relaxation by structure and semantics for retrieval of logical Web documents5F33A99A,ramesh bhashyam,Technology challenges in a data warehouse792661D3,eleanor jaynes,Information Theory and Statistical Mechanics7666C9C7,alistair moffat + justin zobel + nicholas lester,Fast on-line index construction by geometric partitioning787AACB9,stratis d viglas + gao cong + wenfei fan + byron choi,Updating recursive XML views of relations7A7D793B,stephen f altschul + warren gish + eugene w myers + webb miller + david j lipman,Basic local alignment search tool.7F56BC25,hector garciamolina + kenneth salem,Main memory database systems: an overview5EB04CD4,takashi okunaru + mamoru hoshi + kensuke onishi + michihiro kobayakawa,A new method for extracting a period of beat of music in compressed domain of TwinVQ audio compression5BF31C4A,andreas nilsson + daniel olsson,MEP-a Media Event Platform800855AC,panos k chrysanthis + mohamed a sharaf + allexandros labrinidis,Preemptive rate-based operator scheduling in a data stream management system043E3621,marcelo pias + steve wilbur + saleem bhatti + jon crowcroft + tim harris,Lighthouses for Scalable Distributed Location5FDB189F,mohammed j zaki,SPADE: an efficient algorithm for mining frequent sequences769EC81F,karl aberer + p frankhauser + erich j neuhold + gerald huck,Jedi: extracting and synthesizing information from the Web80267FB3,sang kyun cha + kihong kim + juchang lee,Differential logging: a commutative and associative logging scheme for highly parallel main memory database713A53CB,yingwei cui + jennifer widom,Practical lineage tracing in data warehouses7EB1AACC,johannes gehrke + yong yao,The cougar approach to in-network query processing in sensor networks79E61340,ouri wolfson + bo xu,Opportunistic dissemination of spatio-temporal resource information in mobile peer to peer networks7F2CF988,inga sitzmann + peter j stuckey + kenneth a ross,Cost-based unbalanced R-trees7E489285,andrew hume + peter druschel + joseph m hellerstein + thu nguyen + kimberly keeton + yvonne coady + andrew warfield + lex stein + christopher small + russ cox + john detreville,Falling off the cliff: when systems go nonlinear59E0C034,peter pietzuch + margo seltzer + jonathan ledlie,Supporting network coordinates on PlanetLab7FE3D880,thomas g price + raymond lorie + morton m astrahan + donald d chamberlin + p griffiths selinger,Access path selection in a relational database management system80473648,david e goldberg,Genetic algorithms in search7D311839,sudipto guha + rajeev motwani + liadan ocallaghan + nina mishra,Clustering data streams08414F93,zheng zhang + baokai he + k c c chang + chuziang li,The uiuc web integration repository7DAF08D5,benjamin b yao + m t ozsu + n khandelwal,XBench benchmark and performance testing of XML DBMSs7E3E6A4A,steven theodore myers + shlomo hoory + charles rackoff + avner magen,Simple Permutations Mix WellNE34932,a. maedche and s.stabb: ontology learning for the semantic web,n/aNE34935,"j. wang, j. wen, f. h. lochovsky, and wei-ying ma",instancebased schema matching for web databases by domain-specific query probing806D547E,man lung yiu + nikos mamoulis,Clustering objects on a spatial network7E6C0BAC,michael morse + william i grosky + jignesh m patel,Efficient Continuous Skyline Computation77575668,lawrence k lee + h f ting,Maintaining significant stream statistics over sliding windows798A3321,yossi matias + phillip b gibbons,Synopsis data structures for massive data sets80D3CD8D,daniel keren + izchak sharfman + assaf schuster,A geometric approach to monitoring threshold functions over distributed data streams81432590,clement yu + zonghuan wu + weiyi meng + naphtali rishe + kinglup liu,A methodology to retrieve text documents from multiple databases813E781F,khalil amiri + sriram padmanabhan + renu tewari + sanghyun park,DBProxy: a dynamic data cache for web applications7F5FE9B7,ana paula r da silva + hao chi wong + antonio a f loureiro + bruno p s rocha + linnyer b ruiz + marcelo h t martins,Decentralized intrusion detection in wireless sensor networks7F0F8F49,irina rozenbaum + s muthukrishnan + graham cormode,Summarizing and mining inverse distributions on data streams via dynamic inverse sampling5E0B0F43,mike dean + guus schreiber,Owl web ontology language reference763158A9,cheeyong chan + yannis ioannidis,Bitmap index design and evaluation06D08A43,beng chin ooi + ron sacksdavis + ken j mcdonell,Spatial kd-tree: an indexing mechanism for spatial databases7DE3BCB2,freund,Experiments with a new boosting algorithm76119995,lorrie faith cranor + manjula arjula + praveen guduru,User interfaces for privacy agents7EB7CB78,ryusuke masuoka + zhexuan song + yannis labrou + weilun chen + tim finin + lalana kagal,Policy-based Access Control for Task Computing Using Rei7CDC37B9,peter j stuckey + s sudarshan + kenneth a ross + divesh srivastava,Foundations of aggregation constraints7E8CF79B,b hudgins + philip a parker + r n scott,A new strategy for multifunction myoelectric control7B72500E,ralf rantzau,Processing frequent itemset discovery queries by division and set containment join operators019C63DE,josep maria mateosanz + josep domingoferrer,Current Directions in Statistical Data Protection800CCB14,michael j carey + donald kossmann,On saying “Enough already!” in SQL7C54F521,alan mainwaring + david e culler + robert szewczyk + joseph polastre + j h anderson,An analysis of a large scale habitat monitoring application779AA3C5,hiroaki kato + yoshimasa takahashi,Automated Identification of Three-Dimensional Common Structural Features of Proteins7E84C4E8,j rosenberg,Geographical Data Structures Compared: A Study of Data Structures Supporting Region Queries5FBD73B0,charu c aggarwal,On k -anonymity and the curse of dimensionality613B9967,jiawei han + jianyong wang + benjamin w wah + yixin chen + guozhu dong,Multi-dimensional regression analysis of time-series data streams7E1C2B73,sarang dharmapurikar + todd sproull + praveen krishnamurthy + john w lockwood,Deep packet inspection using parallel Bloom filters785F8791,jun miyazaki + yasuhiko kanemasa + haruo yokota,Fat-Btree: an update-conscious parallel directory structure7E3AA341,ueli maurer,New approaches to digital evidence696E29E5,lu qiang + hao pei + wayne he + yuanyuan li + yike guo + moustafa ghanem + vasa curcin + anthony rowe,IT service infrastructure for integrative systems biologyNE35460,y. tho,a dataset collectionNE35461,"j. a. castellanos, j. d. tardss, and j. d. tardos",mobile robot localization and map building: a mulnsensor fusion approachNE35467,"o. wolfson, a. p. sistla, b. xu, j. zhou, s. chamberlain, y. yesha, and n. rishe",tracking moving objects using database technologyNE35468,the stream group,stream: the stanford stream data managerNE35469,m,ivanova and t rischNE31519,"i. tatarinov, z. g. ives, a. y. halevy, and d. s. weld",updating xml77C79E05,r d durbin,Biological sequence analysis : probabilistic models of proteins and nucleic acidsNE16295,weblink,kegg8149321B,richard t snodgrass + christian s jensen,Temporal data management0664F710,vinayak r borkar + sunita sarawagi + kaustubh deshmukh,Automatic text segmentation for extracting structured records7F27944E,sriram padmanabhan + timothy r malkemus + anant jhingran + ramesh c agarwal,Block oriented processing of relational database operations in modern computer architecturesNE36137,c. science and t. board,it roadmap to a geospatial future59342CD5,hong hai do + sergey melnik + erhard rahm,Comparison of Schema Matching EvaluationsNE35689,"h. gonzalez, j. han, and x. li",flowcube: constructuing rfid flowcubes for multi-dimensional analysis of commodity flowsNE35684,c. s. jensen,"location-based services, chapter database aspects of location-based services, pages 115-148"NE35686,"m. f. mokbel, x. xiong, w. g. aref, s. hambrusch, s. prabhakar, and m. hammad",place: a query processor for handling real-time spatio-temporal data streams (demoNE35687,"o. wolfson, a. p. sistla, b. xu, j. zhou, and s. chamberlain",domino: databases for moving objects tracking (demoNE35680,e. j. keogh and m. j. pazzani,pseudo periodic synthetic time seriesNE35681,weblink,sfr-usd tickwise stock data setNE35682,"e. achtert, c. bahm, p. krager, p. kunath, a. pryakhin, and m. renz",efficient reverse k-nearest neighbor search in arbitrary metrie spaces5C917964,david gay + samuel madden + david e culler + eric brewer + philip levis + robert szewczyk + joseph polastre + alec woo,The emergence of networking abstractions and techniques in TinyOS7A1924D9,sunita sarawagi + william w cohen,Exploiting dictionaries in named entity extraction: combining semi-Markov extraction processes and data integration methodsNE36390,g. koutrika and,personalized queries under a gener-alized preference model5F66ED6B,john r smith + chungsheng li + jeffrey scott vitter + yuanchi chang + apostol natsev,Supporting Incremental Join Queries on Ranked Inputs7B549303,andrew mccallum,Information Extraction: Distilling Structured Data from Unstructured Text59B473C8,man lung yiu + kyriakos mouratidis + dimitris papadias + nikos mamoulis,Continuous Nearest Neighbor Monitoring in Road Networks7B33E7E7,seth greenblatt + sherry marcus + thayne r coffman,Graph-based technologies for intelligence analysisNE36395,weblink,xquery 1.0 and xpath 2.0 full-textNE36394,"a. trotmanand,, nexi. now and next",in inexNE36797,"a. r. schmidt, f. waas, m.x. kersten, m.j. carey, i. manolescu, r",busses: xmark: a benchmark for xml data management7BD11013,ting yu + marianne winslett + kent e seamons,Supporting structured credentials and sensitive policies through interoperable strategies for automated trust negotiationNE36795,"f. tian, d. dewitt, j. chen, c",zhang: the design and performance evaluation of alternatives of storage strategies: sigmod record80CDFD97,oliver m duschka + serge abiteboul,Complexity of answering queries using materialized viewsNE36793,"f zemke, m. rys, k. kulkami, j. michels, b. reinwald, f. oczan, z. hua liu, i. davis, k. hare",xmltableNE36792,"c. cunningham, c. a. galindo-legaria, g",graefe: pivot and unpivot: optimization and execution strategies in an rdbmsNE36791,"i. tatarinov, e. vigias, k. beyer, j. shanmugasundaram, e",shekita: storing and qyering ordered xml using a relational database systemNE36799,weblink,topxml63A6E1B5,hector garciamolina + narayanan shivakumar + suresh venkatasubramanian + roy d goldman,Proximity Search in Databases58858554,h z yang + perake larson,Query Transformation for PSJ-Queries5CD7F9DB,anthony j bonner + michael kifer,Concurrency and Communication in Transaction Logic7581421E,h arno jacobsen + joăo pereira + francoise fabret + francois llirbat + kenneth a ross + dennis shasha,Filtering algorithms and implementation for very fast publish/subscribe systems7D57EB09,philip s yu + jiawei han + xifeng yan,Substructure similarity search in graph databasesNE34481,j. beckmann,the cnet e-commerce specifications data set80FDFB8D,mitch cherniack + magdalena balazinska + don carney + hari balakrishnan + ying xing + stan zdonik,Scalable Distributed Stream ProcessingNE34482,"c. brandt, a. deshpande, and",trialdb: a web-based clinical study data management systemNE34484,cnet networks,inc811E53EF,f cook + george tzanetakis,Sound analysis using MPEG compressed audioNE34338,d. dewitt and r. gerber,multiprocessor hash-based join algorithms.vldb85NE34336,"p.-a. chirita, s. idreos, m. koubarakis, and w. nejdl",publish/subscribe for rdf-based p2p networksNE34332,"i. abraham, a. badola, d. bickson, d. malkhi, s. malook, and s. ron",practical locality-awareness for large scale information sharingNE34331,weblink,n/aNE34330,m. weis and f. naumann,duplicate detectionNE36563,"h. adler, p. buonadonna, j. chhabra, m. flanigan, l. krishnamurthy, n. kushalnagar, l. nachman, and m. yarvis",design and deployment of industrial sensor networks: experiences from the north sea and a semiconductor plant7752948,ronald r yager,Fuzzy quotient operators for fuzzy relational databases5C9CBB14,justin moore + ming zhong + kai shen,An Evaluation and Comparison of Current Peer-to-Peer Full-Text Keyword Search Techniques80DF1E00,philip s yu + benjamin c m fung + ke wang,Top-down specialization for information and privacy preservation80CFD048,nirvana meratnia + rolf a de by,Aggregation and comparison of trajectories81FC9D19,helmut wachter + andreas reuter,The ConTract modelNE36423,e.-j. im,optimization the performance of sparse matrix-vector multiplicationNE36422,"b. goethals and m. j. zaki, editors",fimi' 3: proceedings of the icdmworkshop on frequent itemset mining implementationsNE36424,e.-j. im and k. a. yelick,optimizing sparse matrix kernels for data miningNE36426,"r. j. b. jr, b. goethals, and m. j. zaki, editors","fimi' 4: proceedings of the ieee icdm workshop on frequent itemset mining implementations, brighton, uk"08191B3B,goetz graefe,The Cascades Framework for Query Optimization5C193534,philip a bernstein + vassos hadzilacos + nathan a goodman,Concurrency control and recovery in database systemsNE34159,m. arlitt and c. williamson,web server workload characteristics: the search for invariantsNE34158,data stream processing,ieee data engineering bulletin6BA91C44,j e bailey + francois bry + tim furche + sebastian schaffert,Web and Semantic Web Query Languages: A SurveyNE34153,z. shao,mm-cubing: computing iceberg cubes by factorizing the lattice spaceNE34152,c.j. hahn,1994: edited synoptic cloud reports from ships and land stations over the globeNE34151,x. zhang and d. shasha,high performance burst detectionNE34156,m. garofalakis,"data mining and the web: past, present and future"NE34155,v. boginski,on structural properties of the market graphNE34154,y. sismanis,the polynomial complexity of fully materialized coalesced cubesNE28497,weblink,n/a591229D3,yunyao li + h v jagadish + huahai yang,Constructing a Generic Natural Language Interface for an XML Database7EA83BFD,eno thereska + anastassia ailamaki + dushyanth narayanan,Continuous resource monitoring for self-predicting DBMS7C5EB5F6,marwan krunz + turgay korkmaz + spyros tragoudas,An efficient algorithm for finding a path subject to two additive constraints5B4A8543,t v lakshman + fang yu + randy h katz,Gigabit rate packet pattern-matching using TCAM7F3C153A,jan chomicki + parke godfrey + jarek gryz + dongming liang,Skyline with presorting7E430857,kevin li + kaping yee + kirsten swearingen + marti a hearst,Faceted metadata for image search and browsing5B23A7EC,goetz graefe,Executing Nested Queries591DBD9B,carol hahn + julius london + stephen g warren,Edited synoptic cloud reports from ships and land stations over the globe7EEE9A80,j m morrissey,Imprecise information and uncertainty in information systems75427D69,victor m markowitz + arie shoshani,Representing extended entity-relationship structures in relational databases: a modular approach7AA82AB5,anne bruggemannklein + derick wood,One-unambiguous regular languages76D27593,h v jagadish + shaul dar + rakesh agrawal,Direct transitive closure algorithms: design and performance evaluation815D0875,michael stonebreaker,The case for shared nothing7567718B,marco schorlemmer + yannis kalfoglou,Ontology mapping: the state of the art759C813A,david k gifford + kenneth conley + alex c snoeren,Mesh-based content routing using XML5EB1DF23,angel l rubio + jorge lloret + eladio dominguez + maria a zapata,Evolving XML schemas and documents using UML class diagrams7FC66A53,man lung yiu + nikos mamoulis + dimitris papadias,Aggregate nearest neighbor queries in road networks77F2ADDD,karl aberer + manfred hauswirth + philippe cudremauroux,Start making sense: The Chatty Web approach for global semantic agreements02C8F38A,deborah l mcguinness + wei wu + aseem das,Industrial Strength Ontology Management77968EB8,jayadev misra + david gries,Finding Repeated Elements58907520,guido moerkotte + sven helmer,Evaluation of Main Memory Join Algorithms for Joins with Set Comparison Join Predicates7B48B155,robert paige + robert e tarjan,Three partition refinement algorithms7F3F9AEA,hanan samet + jagan sankaranarayanan + houman alborzi,Efficient query processing on spatial networks75146DB1,stephane grumbach + leonardo tininini,On the content of materialized aggregate views7EA169BB,mayur datar + liadan ocallaghan + rajeev motwani + brain babcock,Maintaining variance and k-medians over data stream windows7EE67F7A,anish das sarma + jennifer widom + omar benjelloun + alon halevy,Working Models for Uncertain Data80D954AB,sergey melnik + christoph quix + michalis petropoulos + philip a bernstein,Industrial-strength schema matching7D5C93A9,moshe m zloof,Query-by-example: a data base language5C298D54,richard t snodgrass + christian s jensen + j k bair + michael h bohlen,Notions of Upward Compability of Temporal Query Languages7998D10D,craig silverstein + hinrich schutze,Projections for efficient document clustering7B3CC4A5,daniel c sturman + tushar deepak chandra + robert e strom + mark astley + marcos k aguilera,Matching events in a content-based subscription system